{
  "schemaVersion": 1,
  "manifestId": "manifest_phase7_pilot",
  "datasetCount": 15,
  "taskFamilyCount": 4,
  "taskQueryCount": 50,
  "taskFamilies": [
    "image_classification",
    "object_detection",
    "multi_object_tracking",
    "semantic_or_instance_segmentation"
  ],
  "datasets": [
    { "datasetId": "ds_placeholder_01", "license": "unknown_pending_review", "source": "public_repository", "revision": "rev_000000000000", "acquisition": "versioned_snapshot", "taskFamilies": ["image_classification"], "groundTruthVersion": "gt_placeholder_v1", "perturbationVersions": ["perturbation_none_v1"] },
    { "datasetId": "ds_placeholder_02", "license": "unknown_pending_review", "source": "public_repository", "revision": "rev_000000000000", "acquisition": "versioned_snapshot", "taskFamilies": ["object_detection"], "groundTruthVersion": "gt_placeholder_v1", "perturbationVersions": ["perturbation_none_v1"] },
    { "datasetId": "ds_placeholder_03", "license": "unknown_pending_review", "source": "public_repository", "revision": "rev_000000000000", "acquisition": "versioned_snapshot", "taskFamilies": ["multi_object_tracking"], "groundTruthVersion": "gt_placeholder_v1", "perturbationVersions": ["perturbation_none_v1"] },
    { "datasetId": "ds_placeholder_04", "license": "unknown_pending_review", "source": "public_repository", "revision": "rev_000000000000", "acquisition": "versioned_snapshot", "taskFamilies": ["semantic_or_instance_segmentation"], "groundTruthVersion": "gt_placeholder_v1", "perturbationVersions": ["perturbation_none_v1"] },
    { "datasetId": "ds_placeholder_05", "license": "unknown_pending_review", "source": "public_repository", "revision": "rev_000000000000", "acquisition": "versioned_snapshot", "taskFamilies": ["image_classification"], "groundTruthVersion": "gt_placeholder_v1", "perturbationVersions": ["perturbation_none_v1"] },
    { "datasetId": "ds_placeholder_06", "license": "unknown_pending_review", "source": "public_repository", "revision": "rev_000000000000", "acquisition": "versioned_snapshot", "taskFamilies": ["object_detection"], "groundTruthVersion": "gt_placeholder_v1", "perturbationVersions": ["perturbation_none_v1"] },
    { "datasetId": "ds_placeholder_07", "license": "unknown_pending_review", "source": "public_repository", "revision": "rev_000000000000", "acquisition": "versioned_snapshot", "taskFamilies": ["multi_object_tracking"], "groundTruthVersion": "gt_placeholder_v1", "perturbationVersions": ["perturbation_none_v1"] },
    { "datasetId": "ds_placeholder_08", "license": "unknown_pending_review", "source": "public_repository", "revision": "rev_000000000000", "acquisition": "versioned_snapshot", "taskFamilies": ["semantic_or_instance_segmentation"], "groundTruthVersion": "gt_placeholder_v1", "perturbationVersions": ["perturbation_none_v1"] },
    { "datasetId": "ds_placeholder_09", "license": "unknown_pending_review", "source": "public_repository", "revision": "rev_000000000000", "acquisition": "versioned_snapshot", "taskFamilies": ["image_classification"], "groundTruthVersion": "gt_placeholder_v1", "perturbationVersions": ["perturbation_none_v1"] },
    { "datasetId": "ds_placeholder_10", "license": "unknown_pending_review", "source": "public_repository", "revision": "rev_000000000000", "acquisition": "versioned_snapshot", "taskFamilies": ["object_detection"], "groundTruthVersion": "gt_placeholder_v1", "perturbationVersions": ["perturbation_none_v1"] },
    { "datasetId": "ds_placeholder_11", "license": "unknown_pending_review", "source": "public_repository", "revision": "rev_000000000000", "acquisition": "versioned_snapshot", "taskFamilies": ["multi_object_tracking"], "groundTruthVersion": "gt_placeholder_v1", "perturbationVersions": ["perturbation_none_v1"] },
    { "datasetId": "ds_placeholder_12", "license": "unknown_pending_review", "source": "public_repository", "revision": "rev_000000000000", "acquisition": "versioned_snapshot", "taskFamilies": ["semantic_or_instance_segmentation"], "groundTruthVersion": "gt_placeholder_v1", "perturbationVersions": ["perturbation_none_v1"] },
    { "datasetId": "ds_placeholder_13", "license": "unknown_pending_review", "source": "public_repository", "revision": "rev_000000000000", "acquisition": "versioned_snapshot", "taskFamilies": ["image_classification"], "groundTruthVersion": "gt_placeholder_v1", "perturbationVersions": ["perturbation_none_v1"] },
    { "datasetId": "ds_placeholder_14", "license": "unknown_pending_review", "source": "public_repository", "revision": "rev_000000000000", "acquisition": "versioned_snapshot", "taskFamilies": ["object_detection"], "groundTruthVersion": "gt_placeholder_v1", "perturbationVersions": ["perturbation_none_v1"] },
    { "datasetId": "ds_placeholder_15", "license": "unknown_pending_review", "source": "public_repository", "revision": "rev_000000000000", "acquisition": "versioned_snapshot", "taskFamilies": ["multi_object_tracking"], "groundTruthVersion": "gt_placeholder_v1", "perturbationVersions": ["perturbation_none_v1"] }
  ],
  "taskQueries": [
    { "queryId": "q_placeholder_01", "taskFamily": "image_classification", "queryRevision": "query_rev_000000000000", "groundTruthVersion": "gt_placeholder_v1", "perturbationVersions": ["perturbation_none_v1"] },
    { "queryId": "q_placeholder_02", "taskFamily": "object_detection", "queryRevision": "query_rev_000000000000", "groundTruthVersion": "gt_placeholder_v1", "perturbationVersions": ["perturbation_none_v1"] },
    { "queryId": "q_placeholder_03", "taskFamily": "multi_object_tracking", "queryRevision": "query_rev_000000000000", "groundTruthVersion": "gt_placeholder_v1", "perturbationVersions": ["perturbation_none_v1"] },
    { "queryId": "q_placeholder_04", "taskFamily": "semantic_or_instance_segmentation", "queryRevision": "query_rev_000000000000", "groundTruthVersion": "gt_placeholder_v1", "perturbationVersions": ["perturbation_none_v1"] },
    { "queryId": "q_placeholder_05", "taskFamily": "image_classification", "queryRevision": "query_rev_000000000000", "groundTruthVersion": "gt_placeholder_v1", "perturbationVersions": ["perturbation_none_v1"] },
    { "queryId": "q_placeholder_06", "taskFamily": "object_detection", "queryRevision": "query_rev_000000000000", "groundTruthVersion": "gt_placeholder_v1", "perturbationVersions": ["perturbation_none_v1"] },
    { "queryId": "q_placeholder_07", "taskFamily": "multi_object_tracking", "queryRevision": "query_rev_000000000000", "groundTruthVersion": "gt_placeholder_v1", "perturbationVersions": ["perturbation_none_v1"] },
    { "queryId": "q_placeholder_08", "taskFamily": "semantic_or_instance_segmentation", "queryRevision": "query_rev_000000000000", "groundTruthVersion": "gt_placeholder_v1", "perturbationVersions": ["perturbation_none_v1"] },
    { "queryId": "q_placeholder_09", "taskFamily": "image_classification", "queryRevision": "query_rev_000000000000", "groundTruthVersion": "gt_placeholder_v1", "perturbationVersions": ["perturbation_none_v1"] },
    { "queryId": "q_placeholder_10", "taskFamily": "object_detection", "queryRevision": "query_rev_000000000000", "groundTruthVersion": "gt_placeholder_v1", "perturbationVersions": ["perturbation_none_v1"] },
    { "queryId": "q_placeholder_11", "taskFamily": "multi_object_tracking", "queryRevision": "query_rev_000000000000", "groundTruthVersion": "gt_placeholder_v1", "perturbationVersions": ["perturbation_none_v1"] },
    { "queryId": "q_placeholder_12", "taskFamily": "semantic_or_instance_segmentation", "queryRevision": "query_rev_000000000000", "groundTruthVersion": "gt_placeholder_v1", "perturbationVersions": ["perturbation_none_v1"] },
    { "queryId": "q_placeholder_13", "taskFamily": "image_classification", "queryRevision": "query_rev_000000000000", "groundTruthVersion": "gt_placeholder_v1", "perturbationVersions": ["perturbation_none_v1"] },
    { "queryId": "q_placeholder_14", "taskFamily": "object_detection", "queryRevision": "query_rev_000000000000", "groundTruthVersion": "gt_placeholder_v1", "perturbationVersions": ["perturbation_none_v1"] },
    { "queryId": "q_placeholder_15", "taskFamily": "multi_object_tracking", "queryRevision": "query_rev_000000000000", "groundTruthVersion": "gt_placeholder_v1", "perturbationVersions": ["perturbation_none_v1"] },
    { "queryId": "q_placeholder_16", "taskFamily": "semantic_or_instance_segmentation", "queryRevision": "query_rev_000000000000", "groundTruthVersion": "gt_placeholder_v1", "perturbationVersions": ["perturbation_none_v1"] },
    { "queryId": "q_placeholder_17", "taskFamily": "image_classification", "queryRevision": "query_rev_000000000000", "groundTruthVersion": "gt_placeholder_v1", "perturbationVersions": ["perturbation_none_v1"] },
    { "queryId": "q_placeholder_18", "taskFamily": "object_detection", "queryRevision": "query_rev_000000000000", "groundTruthVersion": "gt_placeholder_v1", "perturbationVersions": ["perturbation_none_v1"] },
    { "queryId": "q_placeholder_19", "taskFamily": "multi_object_tracking", "queryRevision": "query_rev_000000000000", "groundTruthVersion": "gt_placeholder_v1", "perturbationVersions": ["perturbation_none_v1"] },
    { "queryId": "q_placeholder_20", "taskFamily": "semantic_or_instance_segmentation", "queryRevision": "query_rev_000000000000", "groundTruthVersion": "gt_placeholder_v1", "perturbationVersions": ["perturbation_none_v1"] },
    { "queryId": "q_placeholder_21", "taskFamily": "image_classification", "queryRevision": "query_rev_000000000000", "groundTruthVersion": "gt_placeholder_v1", "perturbationVersions": ["perturbation_none_v1"] },
    { "queryId": "q_placeholder_22", "taskFamily": "object_detection", "queryRevision": "query_rev_000000000000", "groundTruthVersion": "gt_placeholder_v1", "perturbationVersions": ["perturbation_none_v1"] },